{
  "$schema": "https://json-schema.org/draft/2020-12/schema",
  "$id": "https://languageapp.example/schemas/manifest.schema.json",
  "title": "Language Pack Manifest",
  "description": "Top-level descriptor for a language learning pack",
  "type": "object",
  "required": ["schemaVersion", "id", "name", "version", "language", "author", "license", "lessons"],
  "properties": {
    "schemaVersion": {
      "type": "string",
      "enum": ["1.0.0", "1.1.0"],
      "description": "Pack format version this manifest conforms to"
    },
    "id": {
      "type": "string",
      "pattern": "^[a-z0-9]+(-[a-z0-9]+)*\\.[a-z0-9]+(-[a-z0-9]+)*(\\.[a-z0-9]+(-[a-z0-9]+)*)+$",
      "description": "Reverse-DNS unique identifier, e.g. com.github.username.nihongo-basics"
    },
    "name": {
      "type": "string",
      "minLength": 1,
      "maxLength": 100,
      "description": "Human-readable pack name"
    },
    "version": {
      "type": "string",
      "pattern": "^\\d+\\.\\d+\\.\\d+(-[\\w.]+)?$",
      "description": "Semantic version of this pack release"
    },
    "description": {
      "type": "string",
      "maxLength": 500
    },
    "language": {
      "type": "object",
      "required": ["code", "name"],
      "properties": {
        "code": {
          "type": "string",
          "pattern": "^[a-z]{2,3}(-[A-Z]{2})?$",
          "description": "ISO 639 code, optional region (e.g. ja, en-US, pt-BR)"
        },
        "name": {
          "type": "string",
          "description": "English name of the language (e.g. Japanese)"
        },
        "nativeName": {
          "type": "string",
          "description": "Name in the language itself (e.g. 日本語)"
        },
        "script": {
          "type": "string",
          "description": "ISO 15924 script code (e.g. Jpan, Latn, Arab)"
        },
        "direction": {
          "type": "string",
          "enum": ["ltr", "rtl"],
          "default": "ltr"
        }
      }
    },
    "uiLanguage": {
      "type": "string",
      "pattern": "^[a-z]{2,3}(-[A-Z]{2})?$",
      "description": "Language used for instructions/translations within this pack (e.g. tr means lessons explain Japanese in Turkish)"
    },
    "level": {
      "type": "string",
      "enum": ["A1", "A2", "B1", "B2", "C1", "C2", "mixed"],
      "description": "CEFR level"
    },
    "author": {
      "type": "object",
      "required": ["name"],
      "properties": {
        "name": { "type": "string" },
        "url": { "type": "string", "format": "uri" },
        "email": { "type": "string", "format": "email" }
      }
    },
    "license": {
      "type": "string",
      "description": "SPDX license identifier (e.g. CC-BY-4.0, MIT, CC-BY-SA-4.0)"
    },
    "homepage": {
      "type": "string",
      "format": "uri"
    },
    "repository": {
      "type": "object",
      "properties": {
        "type": { "type": "string", "enum": ["git"] },
        "url": { "type": "string", "format": "uri" }
      }
    },
    "tags": {
      "type": "array",
      "items": { "type": "string" },
      "maxItems": 20
    },
    "lessons": {
      "type": "array",
      "minItems": 1,
      "items": {
        "type": "object",
        "required": ["id", "file"],
        "properties": {
          "id": {
            "type": "string",
            "pattern": "^[a-z0-9-]+$"
          },
          "file": {
            "type": "string",
            "pattern": "^lessons/[\\w-]+\\.json$"
          },
          "title": { "type": "string" },
          "order": { "type": "integer", "minimum": 0 }
        }
      }
    },
    "dependencies": {
      "type": "array",
      "description": "Other packs this one builds on (by id and version range)",
      "items": {
        "type": "object",
        "required": ["id", "version"],
        "properties": {
          "id": { "type": "string" },
          "version": {
            "type": "string",
            "description": "Semver range, e.g. ^1.0.0"
          }
        }
      }
    },
    "minSdkVersion": {
      "type": "string",
      "pattern": "^\\d+\\.\\d+\\.\\d+$",
      "description": "Minimum SDK version required to load this pack"
    },
    "aiCapabilities": {
      "type": "object",
      "description": "Optional. Declares which AI features this pack expects to support. The SDK uses these flags to decide which AI affordances to surface in the UI; the backend additionally checks the end user's subscription before forwarding to a provider. Pack still works fully offline regardless of these flags.",
      "properties": {
        "questionGeneration": {
          "type": "boolean",
          "description": "AI can synthesize new practice questions from this pack's content"
        },
        "explanation": {
          "type": "boolean",
          "description": "AI can give deeper grammar / etymology / context explanations on demand"
        },
        "conversation": {
          "type": "boolean",
          "description": "AI can hold conversation practice using this pack's vocabulary"
        },
        "hint": {
          "type": "boolean",
          "description": "AI can provide context-aware hints during exercises"
        }
      },
      "additionalProperties": false
    },
    "previousPack": {
      "type": "string",
      "pattern": "^[a-z0-9]+(-[a-z0-9]+)*\\.[a-z0-9]+(-[a-z0-9]+)*(\\.[a-z0-9]+(-[a-z0-9]+)*)+$",
      "description": "Optional. Pack id of the prerequisite pack in a curated level path (e.g. com.paktly.ja.beginner-1)"
    },
    "nextPack": {
      "type": "string",
      "pattern": "^[a-z0-9]+(-[a-z0-9]+)*\\.[a-z0-9]+(-[a-z0-9]+)*(\\.[a-z0-9]+(-[a-z0-9]+)*)+$",
      "description": "Optional. Pack id of the recommended next pack in a curated level path"
    }
  },
  "additionalProperties": false
}
